{
  "ledger_schema_version": "2.0.0",
  "ledger_id": "governed-research-workflow-capability-truth-ledger",
  "ledger_status": "release_source_prepared",
  "release_context": {
    "source_release_version": "v1.19.0",
    "historical_public_baseline": "v1.18.1",
    "live_release_identity_rule": "This v1.19.0 Research Program registry candidate source is derived from immutable public v1.18.1. A selected public version is verified only from its exact annotated tag and matching GitHub Release; this source does not itself prove a hosted release, installed runtime, Study status, Research Program membership, repository existence, privacy or rights decision, human acceptance, scientific fact, governance condition, promotion, or C4 authorization."
  },
  "target_claim_scope": "The public_claim_status field records admitted historical scopes, the frozen v1.0.0 public interface contract, and separately tracked versioned source scopes. Admission and source verification are not public availability, a hosted Release, or installed runtime identity; selected-version availability requires a matching immutable tag and GitHub Release. Historical facts are not automatic admissions for later capabilities.",
  "claim_admission_rule": "A capability may be described as admitted for a named release scope only when its record is verified, admitted for that scope, and has an accountable-human approval reference. Admission alone does not prove a local installation, runtime identity, hosted Release, or authorize a future C4 decision.",
  "contradiction_refusal_rule": "When records conflict or a critical fact is unknown, forbid the affected public claim, stop the affected consequential action, and request accountable-human review.",
  "contradiction_decision_brief_requirements": [
    "conflicting_records_and_exact_locations",
    "known_evidence_and_unknowns",
    "safe_immediate_stop",
    "feasible_repair_options",
    "benefit_cost_compatibility_release_effect_and_residual_risk_per_option",
    "smallest_next_verification",
    "ai_recommendation_separate_from_accountable_human_choice"
  ],
  "capabilities": [
    {
      "capability_id": "GRW-CAP-031-01",
      "public_name": "Human-governed research task routing",
      "capability_class": "routing",
      "implementation_status": "verified",
      "release_disposition": "admitted",
      "public_claim_status": "permitted",
      "promise": "Classifies supported research-work requests, loads only relevant route guidance, and stops for accountable-human control at consequential boundaries.",
      "non_promise": "Does not determine scientific, clinical, ethics, compliance, or publication facts or decisions.",
      "approval_owner": "accountable_human",
      "interface": {
        "status": "present",
        "paths": ["SKILL.md"],
        "identifiers": ["Start Safely", "Mandatory Stops"]
      },
      "profile_scope": "both",
      "data_and_external_boundary": ["no_data_access", "no_external_service_action"],
      "evidence": {
        "status": "verified",
        "references": [{"kind": "test", "path": "tests/test_system_foundation.py", "identifier": "SystemFoundationTests"}]
      },
      "version": {"introduced_version": "v0.1.0", "last_verified_release": "v0.3.1", "target_release": "v0.4.0"},
      "prior_release_history": [{"release_version": "v0.3.1", "public_claim_status": "permitted"}],
      "approval_reference": "accountable-human v0.4.0 Option A capability-set admission accepted 2026-07-17; final exact-commit evidence and C4 release authorization remain required",
      "claim_surfaces": ["SKILL.md", "README.md"],
      "contradiction_refusal": "Do not infer a research decision from task classification; stop and request the relevant evidence or accountable-human approval.",
      "limitations_and_next_action": "Admitted only for the named v0.4.0 release scope. It creates no tag, GitHub Release, normal installation target, runtime-synchronization claim, or C4 authorization; final exact-commit evidence and C4 remain required."
    },
    {
      "capability_id": "GRW-CAP-031-02",
      "public_name": "Controlled empty-workspace bootstrap",
      "capability_class": "helper",
      "implementation_status": "verified",
      "release_disposition": "admitted",
      "public_claim_status": "permitted",
      "promise": "Previews and, after matching human confirmation, creates an allowlisted empty workspace scaffold and provenance receipt.",
      "non_promise": "Does not import data, alter an existing project, advance a project state, or authorize research work.",
      "approval_owner": "accountable_human",
      "interface": {
        "status": "present",
        "paths": ["scripts/bootstrap_empty_workspace.py", "references/controlled-bootstrap.md"],
        "identifiers": ["--confirm-create", "--approval-reference"]
      },
      "profile_scope": "both",
      "data_and_external_boundary": ["no_data_access", "no_external_service_action"],
      "evidence": {
        "status": "verified",
        "references": [{"kind": "test", "path": "tests/test_bootstrap_empty_workspace.py", "identifier": "BootstrapEmptyWorkspaceTests"}]
      },
      "version": {"introduced_version": "v0.2.0", "last_verified_release": "v0.3.1", "target_release": "v0.4.0"},
      "prior_release_history": [{"release_version": "v0.3.1", "public_claim_status": "permitted"}],
      "approval_reference": "accountable-human v0.4.0 Option A capability-set admission accepted 2026-07-17; final exact-commit evidence and C4 release authorization remain required",
      "claim_surfaces": ["SKILL.md", "README.md"],
      "contradiction_refusal": "Refuse an unsafe path, nonempty target, mismatched plan, missing approval reference, overwrite request, or scope beyond an empty scaffold.",
      "limitations_and_next_action": "Admitted only for the named v0.4.0 release scope. It creates no tag, GitHub Release, normal installation target, runtime-synchronization claim, or C4 authorization; final exact-commit evidence and C4 remain required."
    },
    {
      "capability_id": "GRW-CAP-031-03",
      "public_name": "Bounded profile declaration",
      "capability_class": "profile",
      "implementation_status": "verified",
      "release_disposition": "admitted",
      "public_claim_status": "permitted",
      "promise": "Declares standalone and framework-integrated profiles with an explicit framework contract and exact validation target.",
      "non_promise": "Does not promise compatibility with every platform, agent, workspace, framework release, or private environment.",
      "approval_owner": "accountable_human",
      "interface": {
        "status": "present",
        "paths": ["SYSTEM_MANIFEST.yaml", "system/00_manifest_and_profiles/FRAMEWORK_INTEGRATION_PLAN.md"],
        "identifiers": ["standalone", "framework_integrated"]
      },
      "profile_scope": "both",
      "data_and_external_boundary": ["no_data_access", "no_external_service_action"],
      "evidence": {
        "status": "verified",
        "references": [{"kind": "test", "path": "tests/test_framework_candidate_integration.py", "identifier": "FrameworkCandidateIntegrationTests"}]
      },
      "version": {"introduced_version": "v0.3.0", "last_verified_release": "v0.3.1", "target_release": "v0.4.0"},
      "prior_release_history": [{"release_version": "v0.3.1", "public_claim_status": "permitted"}],
      "approval_reference": "accountable-human v0.4.0 Option A capability-set admission accepted 2026-07-17; final exact-commit evidence and C4 release authorization remain required",
      "claim_surfaces": ["README.md", "SYSTEM_MANIFEST.yaml"],
      "contradiction_refusal": "Do not infer profile support from similar folder names, an untagged framework checkout, or private workspace structure.",
      "limitations_and_next_action": "Admitted only for the named v0.4.0 release scope. It creates no tag, GitHub Release, normal installation target, runtime-synchronization claim, or C4 authorization; final exact-commit evidence and C4 remain required."
    },
    {
      "capability_id": "GRW-CAP-031-04",
      "public_name": "Retrospective learning route",
      "capability_class": "record",
      "implementation_status": "verified",
      "release_disposition": "admitted",
      "public_claim_status": "permitted",
      "promise": "Provides a route and blank register for human-reviewed project retrospective and lesson-promotion work.",
      "non_promise": "Does not automatically promote a project observation into shared memory, a system rule, or public material.",
      "approval_owner": "accountable_human",
      "interface": {
        "status": "present",
        "paths": ["references/retrospective-learning.md", "assets/project-retrospective-and-lesson-register.template.md"],
        "identifiers": ["Project retrospective", "lesson promotion"]
      },
      "profile_scope": "both",
      "data_and_external_boundary": ["no_data_access", "no_external_service_action"],
      "evidence": {
        "status": "verified",
        "references": [{"kind": "test", "path": "tests/test_system_foundation.py", "identifier": "SystemFoundationTests"}]
      },
      "version": {"introduced_version": "v0.1.1", "last_verified_release": "v0.3.1", "target_release": "v0.4.0"},
      "prior_release_history": [{"release_version": "v0.3.1", "public_claim_status": "permitted"}],
      "approval_reference": "accountable-human v0.4.0 Option A capability-set admission accepted 2026-07-17; final exact-commit evidence and C4 release authorization remain required",
      "claim_surfaces": ["README.md", "SKILL.md"],
      "contradiction_refusal": "Do not treat a retrospective note or candidate lesson as a reusable instruction without accountable-human review.",